<?xml version='1.0' encoding='UTF-8'?>
<Body xmlns:xsi="http://www.w3.org/2001/XMLSchema-instance"
      xsi:noNamespaceSchemaLocation="../../../ui/Schema.xsd"
>
    <ESection id="hierarchyContainer" title="Hierarchy" noMove="true">
        <EMenuBar isMainMenu="false">
            <EMenu title="Add">
                <EMenuItem id="hierarchyAddEmpty" title="Empty entity"/>
            </EMenu>
            <EMenu title="Select">
                <EMenuItem id="hierarchySelectAll" title="All"/>
                <EMenuItem id="hierarchySelectInvert" title="Invert selection"/>
                <EMenuItem id="hierarchySelectHierarchy" title="Hierarchy"/>
            </EMenu>
            <EButton id="hierarchyDeleteButton" title="Delete"/>
        </EMenuBar>
    </ESection>
</Body>
