<?xml version='1.0' encoding='UTF-8'?>
<Body xmlns:xsi="http://www.w3.org/2001/XMLSchema-instance"
      xsi:noNamespaceSchemaLocation="../../../ui/Schema.xsd"
>
    <ESection id="hierarchyContainer" title="Hierarchy">
        <EMenuBar>
            <EMenu title="Add">
                <EMenuItem id="hierarchyAddEmpty">
                    Empty entity
                </EMenuItem>
            </EMenu>
            <EMenu title="Select">
                <EMenuItem id="hierarchySelectAll">
                    All
                </EMenuItem>
                <EMenuItem id="hierarchySelectInvert">
                    Invert selection
                </EMenuItem>
                <EMenuItem id="hierarchySelectHierarchy">
                    Hierarchy
                </EMenuItem>
            </EMenu>
            <EButton id="hierarchyDeleteButton">
                Delete
            </EButton>
        </EMenuBar>
        <ETree id="hierarchyTree">
            <ETableColumn title="Name"/>
        </ETree>
    </ESection>
</Body>
